<?xml version="1.0" encoding="UTF-8"?>
<?xml-stylesheet type="text/xsl" href="../recipe.xsl"?>
<!-- Include entities to be used in the xml -->
<!DOCTYPE Recipe [
	<!ENTITY % externalEntities SYSTEM "/entities.dtd">
	%externalEntities;
]>

<Recipe xmlns:xsi="http://www.w3.org/2001/XMLSchema-instance" xsi:noNamespaceSchemaLocation="../recipe.xsd">
	<LastModified year="TODO" month="TODO" day="TODO" />
	<Title>Layered Cranberry Jello Salad</Title>
	<Yields>12 Servings</Yields>
	<Source>A VanOrman Original</Source>

	<Description />

	<Ingredients>
		<section>
			<ingredient>Cranberries<amount>1 Lb.</amount></ingredient>
			<ingredient>Pineapple Tidbits<amount>1 20-oz. Can</amount></ingredient>
			<ingredient>Cranberry Gelatin<amount>2 3-oz. Boxes</amount></ingredient>
			<ingredient>Water <amount>1 Cup<note>Boiling</note></amount></ingredient>
			<ingredient>Lemon-Lime Soda<note>Cold</note><amount>2 12-oz. Cans</amount></ingredient>
		</section>
		<section>
			<ingredient>Milk<amount>5 Cups</amount></ingredient>
			<ingredient>Instant Pudding Mix<amount>2-???-oz. Boxes</amount></ingredient>
			<ingredient>Cool Whip<amount>1-???-oz. Container</amount></ingredient>
			<ingredient>Heavy Whipping Cream<amount>1 Pint</amount></ingredient>
			<ingredient>Sugar<amount>1 Cup</amount></ingredient>
		</section>
	</Ingredients>

	<Instructions class="TODO">
		<section>
			<instruction>QZX TODO</instruction>
		</section>
	</Instructions>

	<Modifications>
		<modification>
			If you cannot find Pineapple Tidbits try:
			<ul>
				<li>Chunk Pineapple, run through the food processor</li>
				<li>Chunk Pineapple, Chop with a knife</li>
			</ul>
		</modification>
	</Modifications>
</Recipe>
