<?xml version="1.0" encoding="UTF-8"?>
<?xml-stylesheet type="text/xsl" href="../recipe.xsl"?>
<!-- Include entities to be used in the xml -->
<!DOCTYPE Recipe [
	<!ENTITY % externalEntities SYSTEM "/entities.dtd">
	%externalEntities;
]>

<Recipe xmlns:xsi="http://www.w3.org/2001/XMLSchema-instance" xsi:noNamespaceSchemaLocation="../recipe.xsd">
	<LastModified year="TODO" month="TODO" day="TODO" />
	<Title><span class="TODO">Cream Lime Pie</span></Title>
	<Yields><span class="NOTE">ToDo</span></Yields>
	<Source>
		From the kitchen of <span class="TODO">ToDo</span>
		<Note><span class="TODO">ToDo</span></Note>
	</Source>

	<Description><span class="TODO">ToDo: Add Description</span></Description>

	<Ingredients>
		<section id="IngredientsToDo" title="ToDo">
			<ingredient>ToDo <note>ToDo</note><amount>1 ToDo <note>ToDo</note></amount></ingredient>
		</section>
		<section id="IngredientsToDo" title="ToDo">
			<ingredient>ToDo <note>ToDo</note><amount>1 ToDo <note>ToDo</note></amount></ingredient>
		</section>
	</Ingredients>

	<Preparation>
		<section>
			<prep><span class="TODO">ToDo</span></prep>
		</section>
	</Preparation>
	<Instructions>
		<section id="InstructionsToDo" title="ToDo">
			<instruction>Preheat oven to <span class="TODO">ToDo</span>&deg;</instruction>
			<instruction><span class="TODO">ToDo</span></instruction>
		</section>
		<section id="InstructionsToDo" title="ToDo">
			<instruction><span class="TODO">ToDo</span></instruction>
		</section>
	</Instructions>

	<Notes>
		<note><span class="TODO">ToDo</span></note>
	</Notes>

	<Modifications>
		<modification><span class="TODO">ToDo</span></modification>
	</Modifications>
</Recipe>
