<?xml version="1.0" encoding="UTF-8"?>
<?xml-stylesheet type="text/xsl" href="../recipe.xsl"?>
<!-- Include entities to be used in the xml -->
<!DOCTYPE Recipe [
	<!ENTITY % externalEntities SYSTEM "/entities.dtd">
	%externalEntities;
]>

<Recipe xmlns:xsi="http://www.w3.org/2001/XMLSchema-instance" xsi:noNamespaceSchemaLocation="../recipe.xsd">
	<LastModified year="2025" month="6" day="6" />
	<Title>Chile Colorado</Title>
	<Yields><span class="TODO">???</span></Yields>
	<Source>Based on a Recipe found online.</Source>

	<Description>
		Di loves Chile Colorado, so we tried several Recipes.
		Then we found a good starting recipe online and used that as a starting point.
		We made some modifications and changed to using the InstaPot.
		Now we love it.
	</Description>

	<Ingredients>
		<section>
			<ingredient>Guajillo Chiles<note>Dried</note><amount>8</amount></ingredient>
			<ingredient>Ancho Chiles<note>Dried</note><amount>2</amount></ingredient>
			<ingredient>Onion<amount>&frac12; Large</amount></ingredient>
			<ingredient>Water<amount>2 Cups</amount></ingredient>
			<ingredient>Flour<amount>2 Tablespoons</amount></ingredient>
			<ingredient>Salt<amount>1&frac12; teaspoons</amount></ingredient>
			<ingredient>Pepper<amount>&frac12; teaspoon</amount></ingredient>
		</section>
		<section>
			<ingredient>Oregano<amount>1 teaspoon</amount></ingredient>
			<ingredient>Cumin<amount>&frac12; teaspoon</amount></ingredient>
			<ingredient>Garlic<amount>1 Clove</amount></ingredient>
			<ingredient>Oil<amount>2 Tablspoons</amount></ingredient>
			<ingredient>Stew Meat<amount>2 Lbs.</amount></ingredient>
			<ingredient>Beef Broth <amount>3 Cups<note>1&frac12;-Strength</note></amount></ingredient>
		</section>
	</Ingredients>

	<Instructions>
		<section>
			<instruction>Remove stems and seeds from the Dried Chiles.</instruction>
			<instruction>Cut Onion into 4-6 chunks, and break chunks apart.</instruction>
			<instruction>In small pot, put Chiles, Onions and Water and place on stove with burner set to high until it comes to a boil.</instruction>
			<instruction>Turn burner off and let pot sit for 20 minutes.</instruction>
			<instruction>Cut Stew Meat into chunks that are &approx;1&inch; square.</instruction>
			<instruction>Place Oil in InstaPot and set it to Saut&eacute;.</instruction>
			<instruction>
				When hot, add Stew Meat and cook until it starts to look golden on the outside, then turn InstaPot off.
			</instruction>
			<instruction>
				Remove all of the Chiles and Onions from the pot of Water and place in a blender, along with 1 cup of the now Red Water from the pot.
				Add Flour, Salt, Pepper, Oregano, Cumin and Garlic and blend until evenly smooth.
			</instruction>
			<instruction>Pour the sauce from the blender into the InstaPot and stir.</instruction>
			<instruction>
				Place the Beef Broth in the blender, and run it for a few seconds, then pour that into the InstaPot.
			</instruction>
			<instruction>Set the InstaPot to Pressure Cook for 15 minutes.</instruction>
			<instruction>
				After Pressure Cooking is complete, let it sit for 15 minutes, then release any pressure.
			</instruction>
			<instruction>Stir gently and serve.</instruction>
		</section>
	</Instructions>

	<Notes>
		<note>
			If you put the meat into the InstaPot before it gets hot, it will change the texture in a not so good way.
		</note>
		<note>
			This must <span class="SMALL_NOTE">(sarcasm)</span> be served with Mexican Fried Rice.
			If you start the recipe right when the Pressure Cooking is set, then both recipes should complete at about the same time.
		</note>
	</Notes>

	<Modifications>
		<modification>
			You can create the 1&frac12;-Strength Beef Broth by using 3 Cups of Water + 4&frac12; Bouillon Cubes, or 1&frac12; Tablespoons Bouillon Powder
			<span class="NOTE">(or the equivalent)</span>.
		</modification>
		<modification>
			To make it more spicy, add 1-3 Arbol Chiles
			<span class="NOTE">(Dried)</span>
			with the other Chiles
			<span class="NOTE">(Dried)</span>.
		</modification>
	</Modifications>
</Recipe>
