<?xml version="1.0" encoding="UTF-8"?>
<?xml-stylesheet type="text/xsl" href="../recipe.xsl"?>
<!-- Include entities to be used in the xml -->
<!DOCTYPE Recipe [
	<!ENTITY % externalEntities SYSTEM "/entities.dtd">
	%externalEntities;
]>

<Recipe xmlns:xsi="http://www.w3.org/2001/XMLSchema-instance" xsi:noNamespaceSchemaLocation="../recipe.xsd">
	<LastModified year="2025" month="6" day="6" />
	<Title>Redhead Carrots</Title>
	<Yields>3-4 Servings</Yields>
	<Source>A VanOrman Original</Source>

	<Description>
		Almost nobody in Ransom's family likes sweet potatoes, or yams.
		This slightly sweet recipe takes their place at Thanksgiving.
		<br />
		Also, most of Ransom's family members have red hair, so we are considered "Gingers".
		And, since Ginger is one of the primary ingredients, the name "Redhead Carrots" seemed appropriate.
	</Description>

	<Ingredients>
		<section>
			<ingredient>Carrots<amount>2-3</amount></ingredient>
			<ingredient>Fresh Ginger<note>finely grated</note><amount>1 Tablespoon</amount></ingredient>
			<ingredient>Brown Sugar<amount>2 Tablespoons</amount></ingredient>
			<ingredient>Minced Garlic<amount>&frac12; teaspoon</amount></ingredient>
			<ingredient>Chicken Broth<note>Double-Strength</note><amount>2 Cups</amount></ingredient>
			<ingredient>Butter<amount>2 Tablespoons</amount></ingredient>
		</section>
	</Ingredients>

	<Instructions>
		<section>
			<instruction>Peel Carrots and cut into 1&inch; chunks.</instruction>
			<instruction>Pull all ingredients into a saucepan.</instruction>
			<instruction>Place on stove and heat on high until it is boiling.</instruction>
			<instruction>Reduce heat to medium/medium low and simmer until Carrots are soft.</instruction>
			<instruction>Drain and serve hot.</instruction>
		</section>
	</Instructions>

	<Modifications>
		<modification>
			You can create the Double-Strength Chicken Broth by using 2 Cups Water + 4 Chicken Bouillon Cubes
			<span class="NOTE">(or the equivalent)</span>.
		</modification>
		<modification>For a little kick, add &frac12; teaspoon White Pepper.</modification>
	</Modifications>
</Recipe>
