<?xml version="1.0" encoding="UTF-8"?>
<?xml-stylesheet type="text/xsl" href="../recipe.xsl"?>
<!-- Include entities to be used in the xml -->
<!DOCTYPE Recipe [
	<!ENTITY % externalEntities SYSTEM "/entities.dtd">
	%externalEntities;
]>

<Recipe xmlns:xsi="http://www.w3.org/2001/XMLSchema-instance" xsi:noNamespaceSchemaLocation="../recipe.xsd">
	<LastModified year="2025" month="6" day="6" />
	<Title>Dutch Spanish Rice</Title>
	<Yields>10-12 Servings</Yields>
	<Source />

	<Description>
		Ransom's dad, Grandpa John, originally cooked a version of this recipe over a camp fire in a Dutch Oven.
		He would cook it with plenty of hamburger and homemade bottled tomatoes and serve it as a main course.
		<br />
		This recipe is a little simpler and is intended as a side dish.
	</Description>

	<Ingredients>
		<section>
			<ingredient>Onions<note>Medium</note><amount>2<note>or 1 Large</note></amount></ingredient>
			<ingredient>Hamburger<amount>1 Lb.</amount></ingredient>
			<ingredient>Rice<amount>3 Cups</amount></ingredient>
			<ingredient>Diced Tomatoes<amount>2 14.5-oz. Cans</amount></ingredient>
			<ingredient>Tomato Sauce<amount>2 15-oz. Cans</amount></ingredient>
			<ingredient>Salt<amount>1 Tablespoon</amount></ingredient>
			<ingredient>Pepper<amount>1 teaspoon</amount></ingredient>
			<ingredient>Water<amount>1 Quart</amount></ingredient>
			<ingredient>Green Bell Pepper<amount>1</amount></ingredient>
		</section>
	</Ingredients>

	<Instructions>
		<section>
			<instruction>
				Chop Onions into small pieces. <span class="NOTE">(&approx;&frac12;&inch;&by;1&inch;)</span>
			</instruction>
			<instruction>
				In a large pot, combine Onions and Hamburger, and cook on high until Hamburger is browned.
			</instruction>
			<instruction>Add Rice, Tomatoes, Tomato Sauce, Salt, Pepper and Water, then mix well.</instruction>
			<instruction>
				Put a lid on the pot and stirring frequently with a Spatula, heat mixture until it starts to boil.
			</instruction>
			<instruction>While mixture is heating, cut Peppers into small pieces (&approx;&frac12;&inch;&by;1&inch;), then stir them into the mixture.</instruction>
			<instruction>Once mixture starts to boil, reduce heat to medium.</instruction>
			<instruction>Stirring occasionally, let simmer until Rice is cooked. (&approx;30-45 minutes.)</instruction>
		</section>
	</Instructions>

	<Notes>
		<note>
			<span class="EMPHASIZE">It is <span class="SUPER_EMPHASIZE">crucial</span>
			to scrape the bottom well when stirring!</span>
			<br />
			Otherwise, everything will end up tasting burned.
		</note>
	</Notes>

	<Modifications>
		<modification>
			Add an extra pound or two of Hamburger to turn this into a main course instead of a side dish.
			<span class="NOTE"><span class="HIGHLIGHT">NOTE</span>:
			Main course servings are about double side dish servings, so it will serve only 5-6 people.</span>
		</modification>
		<modification>
			If you wish larger chunks of Tomato, you can use cans of Sliced or even Stewed Tomatoes.
			<br />
			If you do so, you may wish to use your Spatula to break up the bigger pieces.
		</modification>
		<modification>
			For a little savorier taste, use 2 Poblano peppers instead of the Green Bell Pepper.
			<br />
			If you do this, add them when adding the Onions instead of later on.
		</modification>
	</Modifications>
</Recipe>
