<?xml version="1.0" encoding="UTF-8"?>
<?xml-stylesheet type="text/xsl" href="../recipe.xsl"?>
<!-- Include entities to be used in the xml -->
<!DOCTYPE Recipe [
	<!ENTITY % externalEntities SYSTEM "/entities.dtd">
	%externalEntities;
]>

<Recipe xmlns:xsi="http://www.w3.org/2001/XMLSchema-instance" xsi:noNamespaceSchemaLocation="../recipe.xsd">
	<LastModified year="2025" month="6" day="6" />
	<Title>Rice</Title>
	<Yields>2 servings</Yields>
	<Source>Basic</Source>

	<Description>
		It wasn't until my mission that I found out how much of a difference there is between Minute Rice, and real Rice.
		In Puerto Rico,
		<span class="HIGHLIGHT">nobody</span>
		uses Minute Rice because its taste and consistency are
		<span class="EMPHASIZE">terrible</span>
		compared to the real stuff.
		<br />
		Rice is cheap, can be stored for years and years before it is cooked, and it's a great, generic side dish.
	</Description>

	<Ingredients>
		<section>
			<ingredient>Rice<amount>1 Cup</amount></ingredient>
			<ingredient>Water<amount>2 Cups</amount></ingredient>
			<ingredient>Salt<amount>&frac12; teaspoon</amount></ingredient>
			<ingredient>Vegetable Oil<amount>1 Tablespoon</amount></ingredient>
		</section>
	</Ingredients>

	<Instructions>
		<section>
			<instruction>In a saucepan with a lid, combine all ingredients.</instruction>
			<instruction>Bring everything to a boil.</instruction>
			<instruction>Reduce heat to medium low and let simmer for &approx;20 minutes.</instruction>
			<instruction>Remove from heat, stir, and fluff up.</instruction>
		</section>
	</Instructions>

	<Notes>
		<note>The lid needs to stay in place to keep heat and moisture mostly contained.</note>
		<note>The slower the Rice simmers, the better. If you do it too hot, the rice at the bottom will burn.</note>
		<note>Do not stir Rice while it is cooking.</note>
	</Notes>

	<Modifications>
		<modification>You can substitute 1 Tablespoon of Butter for the Vegetable Oil.</modification>
		<modification>
			If you have a Rice Cooker, replace steps with:
			<ol>
				<li>Throw everything in Rice Cooker and turn it on.</li>
				<li>When it says it is done, stir and fluff up.</li>
			</ol>
		</modification>
	</Modifications>
</Recipe>
