<?xml version="1.0" encoding="UTF-8"?>
<?xml-stylesheet type="text/xsl" href="../../recipe.xsl"?>
<!-- Include entities to be used in the xml -->
<!DOCTYPE Recipe [
	<!ENTITY % externalEntities SYSTEM "/entities.dtd">
	%externalEntities;
]>

<Recipe xmlns:xsi="http://www.w3.org/2001/XMLSchema-instance" xsi:noNamespaceSchemaLocation="../../recipe.xsd">
	<LastModified year="2025" month="6" day="6" />
	<Title>Twisties</Title>
	<Yields>Depends upon how much Dough you make. &smiley;</Yields>
	<Source>A VanOrman Original</Source>

	<Description>
		When ever you make Dutch Father's Pizza, make sure you make extra Crust dough.
		<br />
		A <span class="SUPER_EMPHASIZE">lot</span> so you can make these for dessert afterwards!
	</Description>

	<Ingredients>
		<section id="Dough" title="Dough">
			<ingredient>Dutch Father's Pizza Dough<amount>A Lot</amount></ingredient>
			<ingredient>Fillings<amount>A Lot</amount></ingredient>
		</section>
		<section id="Fillings" title="&quot;Fillings&quot; Ideas">
			<ingredient>Jam</ingredient>
			<ingredient>Honey</ingredient>
			<ingredient>Chocolate Syrup</ingredient>
			<ingredient>
				Honey Butter
				<note>See recipe for <a href=".../Sauces/HoneyButter.xml">Honey Butter</a></note>
			</ingredient>
			<ingredient>etc.</ingredient>
		</section>
	</Ingredients>

	<Instructions>
		<section>
			<instruction>
				Make Crust dough from the recipe for
				<a href=".../Camping/Entrees/DO_DutchFathersPizza.xml#IngredientsCrust">Dutch Father's Pizza</a>
			</instruction>
			<instruction>Roll dough into 2&feet; long&by;&frac12;&inch; diameter "snakes".</instruction>
			<instruction>Wrap around a smooth, 1&inch; diameter stick.</instruction>
			<instruction>
				Cook over a campfire, like you would a marshmallow, only slower, until golden brown.
			</instruction>
			<instruction>Slide off stick, and drizzle desired Fillings down the middle.</instruction>
		</section>
	</Instructions>

	<FinalNote>Sometimes, one per person is nowhere near enough. &smiley;</FinalNote>
</Recipe>
