<?xml version="1.0" encoding="UTF-8"?>
<?xml-stylesheet type="text/xsl" href="../../recipe.xsl"?>
<!-- Include entities to be used in the xml -->
<!DOCTYPE Recipe [
	<!ENTITY % externalEntities SYSTEM "/entities.dtd">
	%externalEntities;
]>

<Recipe xmlns:xsi="http://www.w3.org/2001/XMLSchema-instance" xsi:noNamespaceSchemaLocation="../../recipe.xsd">
	<LastModified year="2025" month="6" day="6" />
	<Title>Pasta (Spaghetti)</Title>
	<Yields>about 4 servings</Yields>
	<Source>Basic</Source>

	<Description>
		Don't even think about doing pasta from scratch.
		<span class="NOTE">(Except egg noodles.)</span>
		Just buy a box at the store.
		It ends up being cheaper, and a lot less hassle.
		Here is how to prepare them.
	</Description>

	<Ingredients>
		<section>
			<ingredient>
				Pasta <note>Spaghetti, Linguini, Fettuccini, etc.</note>
				<amount>1 16-oz. Box</amount>
			</ingredient>
			<ingredient>Salt<amount>1 teaspoon</amount></ingredient>
			<ingredient>Oil<note>Preferably Olive Oil</note><amount>1 Tablespoon</amount></ingredient>
		</section>
	</Ingredients>

	<Instructions>
		<section>
			<instruction>
				Fill a medium sized pot &frac34; full of water and add Salt and 1 teaspoon of Oil.
			</instruction>
			<instruction>Bring water to a boil.</instruction>
			<instruction>
				Place Pasta into boiling water. This can be done in two ways:
				<ul>
					<li>
						Shorter and easier:
						<br />
						Break the lengths of Pasta in half.
						With small amounts at a time, place Pasta into pot at different angles.
						(If you place a whole handful in at a time, it will stick together and cook unevenly.)
					</li>
					<li>
						Longer:
						<br />
						Place Pasta end down into the water.
						Half of it will stick up out of the water.
						As the Pasta begins to cook it will begin to soften.
						As it softens, gently press it down, until eventually all of the Pasta is submerged.
					</li>
				</ul>
			</instruction>
			<instruction>
				After &approx;10 minutes, check to see if Pasta is cooked.
				The traditional way to do this is to fish out one strand of Pasta and toss it onto a wall or cupboard door.
				If it sticks, it is done, if not it needs to cook longer.
			</instruction>
			<instruction>Strain the Water from the Pasta and return it to the pot.</instruction>
			<instruction>
				Add the other 2 teaspoons of Oil and stir the Pasta so that the Oil is distributed evenly.
			</instruction>
		</section>
	</Instructions>

	<Notes>
		<note>
			It is extremely important to not add the Pasta to the water until it is
			<span class="EMPHASIZE">boiling!</span>
			If you do, the Pasta will begin to break down before it cooks and either gets pasty, or completely falls apart.
		</note>
		<note>
			The Oil added to the water will help keep the foaming down so it is easier to see the cooking Pasta.
		</note>
		<note>
			Traditional Italian cooks will choke on step 6.
			However, it keeps the Pasta from sticking and becoming an unservable mass.
			<br />
			If you really don't want to this, then after straining the boiling water, half-fill the pot with hot
			<span class="NOTE">(not boiling)</span>
			water.
			This will keep the Pasta warm without over cooking it.
		</note>
	</Notes>
</Recipe>
