<?xml version="1.0" encoding="UTF-8"?>
<?xml-stylesheet type="text/xsl" href="../../recipe.xsl"?>
<!-- Include entities to be used in the xml -->
<!DOCTYPE Recipe [
	<!ENTITY % externalEntities SYSTEM "/entities.dtd">
	%externalEntities;
]>

<Recipe xmlns:xsi="http://www.w3.org/2001/XMLSchema-instance" xsi:noNamespaceSchemaLocation="../../recipe.xsd">
	<LastModified year="2025" month="6" day="6" />
	<Title>Wontons</Title>
	<Yields>20-25 Wontons</Yields>
	<Source>From the Kitchen of Gramma Mitzi, Di's Mom</Source>

	<Description>
		When Di looks back and remembers peaceful times at home, she remembers her mom making Wonton Soup.
		We came up with this recipe to be able to make Wonton Soup.
		Then we used leftovers to make Fried Wontons.
	</Description>

	<Ingredients>
		<section>
			<ingredient>Ground Pork<amount>&frac12; Lb.</amount></ingredient>
			<ingredient>Minced Garlic<amount>1 teaspoon</amount></ingredient>
			<ingredient>Green Onion, Finely Chopped<amount>3 Tablespoons</amount></ingredient>
			<ingredient>Yolk<amount>1 Egg</amount></ingredient>
			<ingredient>Soy Sauce<amount>2 teaspoons</amount></ingredient>
			<ingredient>Rice Vinegar<amount>1&frac12; teaspoons</amount></ingredient>
			<ingredient>Sesame Oil<amount>&frac12; teaspoon</amount></ingredient>
			<ingredient>Crushed Red Pepper<amount>&frac14; teaspoon</amount></ingredient>
			<ingredient>Grated Ginger<note>Unless Di is there.</note><amount>1 teaspoon</amount></ingredient>
			<ingredient>Wonton Wrappers<amount>25-30</amount></ingredient>
		</section>
	</Ingredients>

	<Instructions>
		<section>
			<instruction>In a bowl combine all of the ingredients, except for the Wrappers, and mix well.</instruction>
			<instruction>Get out a cup or small bowl and fill with &approx;1 Cup Water.</instruction>
			<instruction>
				Form the Wontons using one of the following styles:
				<subSection
					title="Envelope Style"
					list-style="lower-alpha"
					image=".../_images/EnvelopeStyleWonton.png"
					font-size=".9em">
					<instruction>
						Place 1 skin flat on the table and place 1 teaspoon of the filler in the middle.
					</instruction>
					<instruction>Dip a finger in the Water and moisten each edge of the Wrapper.</instruction>
					<instruction>
						Fold one corner of the Wrapper to the corner opposite of it, so that you will get a triangle.
					</instruction>
					<instruction>
						Press down the edges, taking care to press all of the air out before the seal is complete.
					</instruction>
					<instruction>Arrange the Wonton so that the longest edge is toward you.</instruction>
					<instruction>Moisten the top &frac12;" surface of the right corner and the bottom &frac12;" surface of the left corner.</instruction>
					<instruction>
						Place index finger, fingernail down, halfway between right and left corners.
					</instruction>
					<instruction>
						Fold the left corner up onto your finger, then the right corner on top of the left corner.
					</instruction>
					<instruction>Pinch the two corners together.</instruction>
					<instruction>Gently set aside.</instruction>
				</subSection>
				<subSection
					title="4-Star Style"
					list-style="lower-alpha"
					image=".../_images/4StarStyleWonton.png"
					font-size=".9em">
					<instruction>
						Place 1 skin flat on the table and place 1 teaspoon of the filler in the middle.
					</instruction>
					<instruction>Dip a finger in the Water and moisten each edge of the Wrapper.</instruction>
					<instruction>Fold all 4 points of the wonton skin up to the center.</instruction>
					<instruction>Pinch each edge from the center point to the outside edge, taking care to press all air out before the seal is complete.</instruction>
					<instruction>Gently set aside.</instruction>
				</subSection>
			</instruction>
		</section>
	</Instructions>

	<Notes pageBreak="true">
		<note>You can buy Wonton Wrappers at most grocery stores. A 14-oz. package contains about 44 skins.</note>
	</Notes>

	<Modifications>
		<modification>
			Do <span class="SUPER_EMPHASIZE">NOT</span> use Grated Ginger if Di is eating with you!
			<br />
			Di doesn't like Ginger, so her mom set it in a bowl on the table and it was used as a condiment.
		</modification>
	</Modifications>
</Recipe>
